Forum,Forum
Join Discord Participate in organised events,Join Discord! Participate in organised events.
Report a bug,Report bug
Thank you for supporting Holdfast Nations At War,Thank you for supporting Holdfast: Nations At War!
View roadmap,View roadmap
We are actively developing the game based on community feedback Work on improving melee combat is ongoing to continue promote competitiveness  Anvil Game Studios,We are actively developing the game based on community feedback. Work on improving melee combat is ongoing to continue promote competitiveness. - <b>Anvil Game Studios</b>
